col,col_2,"such as Artificial Intelligence (AI) and
Machine Learning (ML) Shri Kamath's
vision for sustained growth, operational
efficiency, and technological innovation
positions him as a key driver of MRPL's
success and a leader at the forefront of
the industry's advancements.",col_3,col_4,col_5,col_6,col_7
"Shri
Nandaku
mar
Velayudha
n Pillai
(DIN:
10735946)",Director (Refinery),"Shri Nandakumar Velayudhan Pillai is a
distinguished expert in the oil and gas
industry, with over three decades of
extensive experience in petroleum
refining and petrochemicals. His deep
industry knowledge spans Operations,
Technical Services, Projects, and
Production Planning, acquired through
his service in various capacities within
petroleum refineries. He has played
pivotal roles in the execution, operation,
and maintenance of three phases of a
grassroots refinery and multiple
petrochemical processing units,
including an aromatic complex. During
his previous tenure as Group General
Manager (Corporate Strategy), Shri
Nandakumar led MRPL's initiatives to
diversify its product portfolio and
navigate uncertain market conditions
while championing sustainable practices.
With a proven track record of managing
high-value projects, including a $500
million investment during the Phase-3
refinery expansion, Shri Nandakumar is
a strong advocate for collaboration,
innovation, team building, and
mentorship. His contributions to the
industry extend to his role as a Convener
for one of the subcommittees of the
Bureau of Indian Standards and his
involvement in a government-appointed
task force that selects Centres of
Excellence in Plastics, Polymer, and
Petrochemicals research. Shri
Nandakumar, holds a BE degree in
Chemical Engineering, graduated with
First Rank from Government
Engineering College, Thrissur, Calicut
University. He has also completed a
postgraduate certificate program in
management from T.A. Pai Management
Institute, Manipal.",,NIL,NA,NIL,NA
"Shri
Devendra
Kumar
(DIN:
11000531)","Director (Finance)
& CFO","Shri Devendra Kumar joined ONGC in
February, 1991 and has over 35 years of
experience in different functions of
Finance & Accounts including around 15
years with ONGC Videsh Ltd.Shri
Devendra Kumar is Post Graduate in
Management from IIM Ahmedabad",,NIL,NA,NIL,NA
